
*** Running vivado
    with args -log I2CTopModule.vdi -applog -m64 -product Vivado -messageDb vivado.pb -mode batch -source I2CTopModule.tcl -notrace


****** Vivado v2019.1.1 (64-bit)
  **** SW Build 2580384 on Sat Jun 29 08:12:21 MDT 2019
  **** IP Build 2579722 on Sat Jun 29 11:35:40 MDT 2019
    ** Copyright 1986-2019 Xilinx, Inc. All Rights Reserved.

source I2CTopModule.tcl -notrace
Command: link_design -top I2CTopModule -part xc7z010clg400-1
Design is defaulting to srcset: sources_1
Design is defaulting to constrset: constrs_1
INFO: [Device 21-403] Loading part xc7z010clg400-1
INFO: [Netlist 29-17] Analyzing 2 Unisim elements for replacement
INFO: [Netlist 29-28] Unisim Transformation completed in 0 CPU seconds
INFO: [Project 1-479] Netlist was created with Vivado 2019.1.1
INFO: [Project 1-570] Preparing netlist for logic optimization
Parsing XDC File [D:/github_repository/zybo-z7-10/I2C_PCF8574/I2C_PCF8574.srcs/constrs_1/imports/zybo-z10_workspace/Zybo-Z7-Master.xdc]
Finished Parsing XDC File [D:/github_repository/zybo-z7-10/I2C_PCF8574/I2C_PCF8574.srcs/constrs_1/imports/zybo-z10_workspace/Zybo-Z7-Master.xdc]
INFO: [Opt 31-138] Pushed 0 inverter(s) to 0 load pin(s).
Netlist sorting complete. Time (s): cpu = 00:00:00 ; elapsed = 00:00:00 . Memory (MB): peak = 631.125 ; gain = 0.000
INFO: [Project 1-111] Unisim Transformation Summary:
  A total of 1 instances were transformed.
  IOBUF => IOBUF (IBUF, OBUFT): 1 instances

7 Infos, 0 Warnings, 0 Critical Warnings and 0 Errors encountered.
link_design completed successfully
link_design: Time (s): cpu = 00:00:06 ; elapsed = 00:00:08 . Memory (MB): peak = 631.125 ; gain = 338.902
Command: opt_design
Attempting to get a license for feature 'Implementation' and/or device 'xc7z010'
INFO: [Common 17-349] Got license for feature 'Implementation' and/or device 'xc7z010'
Running DRC as a precondition to command opt_design

Starting DRC Task
INFO: [DRC 23-27] Running DRC with 2 threads
INFO: [Project 1-461] DRC finished with 0 Errors
INFO: [Project 1-462] Please refer to the DRC report (report_drc) for more information.

Time (s): cpu = 00:00:01 ; elapsed = 00:00:00.668 . Memory (MB): peak = 652.086 ; gain = 20.961

Starting Cache Timing Information Task
INFO: [Timing 38-35] Done setting XDC timing constraints.
Ending Cache Timing Information Task | Checksum: d80d6f3e

Time (s): cpu = 00:00:10 ; elapsed = 00:00:10 . Memory (MB): peak = 1193.027 ; gain = 540.941

Starting Logic Optimization Task

Phase 1 Retarget
INFO: [Opt 31-138] Pushed 2 inverter(s) to 2 load pin(s).
INFO: [Opt 31-49] Retargeted 0 cell(s).
Phase 1 Retarget | Checksum: cd28c943

Time (s): cpu = 00:00:00 ; elapsed = 00:00:00.016 . Memory (MB): peak = 1332.379 ; gain = 0.000
INFO: [Opt 31-389] Phase Retarget created 0 cells and removed 3 cells

Phase 2 Constant propagation
INFO: [Opt 31-138] Pushed 0 inverter(s) to 0 load pin(s).
Phase 2 Constant propagation | Checksum: cd28c943

Time (s): cpu = 00:00:00 ; elapsed = 00:00:00.018 . Memory (MB): peak = 1332.379 ; gain = 0.000
INFO: [Opt 31-389] Phase Constant propagation created 0 cells and removed 0 cells

Phase 3 Sweep
Phase 3 Sweep | Checksum: cd28c943

Time (s): cpu = 00:00:00 ; elapsed = 00:00:00.020 . Memory (MB): peak = 1332.379 ; gain = 0.000
INFO: [Opt 31-389] Phase Sweep created 0 cells and removed 0 cells

Phase 4 BUFG optimization
Phase 4 BUFG optimization | Checksum: cd28c943

Time (s): cpu = 00:00:00 ; elapsed = 00:00:00.022 . Memory (MB): peak = 1332.379 ; gain = 0.000
INFO: [Opt 31-662] Phase BUFG optimization created 0 cells of which 0 are BUFGs and removed 0 cells.

Phase 5 Shift Register Optimization
INFO: [Opt 31-1064] SRL Remap converted 0 SRLs to 0 registers and converted 0 registers of register chains to 0 SRLs
Phase 5 Shift Register Optimization | Checksum: cd28c943

Time (s): cpu = 00:00:00 ; elapsed = 00:00:00.024 . Memory (MB): peak = 1332.379 ; gain = 0.000
INFO: [Opt 31-389] Phase Shift Register Optimization created 0 cells and removed 0 cells

Phase 6 Post Processing Netlist
Phase 6 Post Processing Netlist | Checksum: cd28c943

Time (s): cpu = 00:00:00 ; elapsed = 00:00:00.026 . Memory (MB): peak = 1332.379 ; gain = 0.000
INFO: [Opt 31-389] Phase Post Processing Netlist created 0 cells and removed 0 cells
Opt_design Change Summary
=========================


-------------------------------------------------------------------------------------------------------------------------
|  Phase                        |  #Cells created  |  #Cells Removed  |  #Constrained objects preventing optimizations  |
-------------------------------------------------------------------------------------------------------------------------
|  Retarget                     |               0  |               3  |                                              0  |
|  Constant propagation         |               0  |               0  |                                              0  |
|  Sweep                        |               0  |               0  |                                              0  |
|  BUFG optimization            |               0  |               0  |                                              0  |
|  Shift Register Optimization  |               0  |               0  |                                              0  |
|  Post Processing Netlist      |               0  |               0  |                                              0  |
-------------------------------------------------------------------------------------------------------------------------



Starting Connectivity Check Task

Time (s): cpu = 00:00:00 ; elapsed = 00:00:00 . Memory (MB): peak = 1332.379 ; gain = 0.000
Ending Logic Optimization Task | Checksum: cd28c943

Time (s): cpu = 00:00:00 ; elapsed = 00:00:00.028 . Memory (MB): peak = 1332.379 ; gain = 0.000

Starting Power Optimization Task
INFO: [Pwropt 34-132] Skipping clock gating for clocks with a period < 2.00 ns.
Ending Power Optimization Task | Checksum: cd28c943

Time (s): cpu = 00:00:00 ; elapsed = 00:00:00.008 . Memory (MB): peak = 1332.379 ; gain = 0.000

Starting Final Cleanup Task
Ending Final Cleanup Task | Checksum: cd28c943

Time (s): cpu = 00:00:00 ; elapsed = 00:00:00 . Memory (MB): peak = 1332.379 ; gain = 0.000

Starting Netlist Obfuscation Task
Netlist sorting complete. Time (s): cpu = 00:00:00 ; elapsed = 00:00:00 . Memory (MB): peak = 1332.379 ; gain = 0.000
Ending Netlist Obfuscation Task | Checksum: cd28c943

Time (s): cpu = 00:00:00 ; elapsed = 00:00:00.001 . Memory (MB): peak = 1332.379 ; gain = 0.000
INFO: [Common 17-83] Releasing license: Implementation
24 Infos, 0 Warnings, 0 Critical Warnings and 0 Errors encountered.
opt_design completed successfully
opt_design: Time (s): cpu = 00:00:13 ; elapsed = 00:00:13 . Memory (MB): peak = 1332.379 ; gain = 701.254
Netlist sorting complete. Time (s): cpu = 00:00:00 ; elapsed = 00:00:00.001 . Memory (MB): peak = 1332.379 ; gain = 0.000
INFO: [Timing 38-480] Writing timing data to binary archive.
Writing placer database...
Writing XDEF routing.
Writing XDEF routing logical nets.
Writing XDEF routing special nets.
Write XDEF Complete: Time (s): cpu = 00:00:00 ; elapsed = 00:00:00.073 . Memory (MB): peak = 1332.379 ; gain = 0.000
INFO: [Common 17-1381] The checkpoint 'D:/github_repository/zybo-z7-10/I2C_PCF8574/I2C_PCF8574.runs/impl_1/I2CTopModule_opt.dcp' has been generated.
INFO: [runtcl-4] Executing : report_drc -file I2CTopModule_drc_opted.rpt -pb I2CTopModule_drc_opted.pb -rpx I2CTopModule_drc_opted.rpx
Command: report_drc -file I2CTopModule_drc_opted.rpt -pb I2CTopModule_drc_opted.pb -rpx I2CTopModule_drc_opted.rpx
INFO: [IP_Flow 19-234] Refreshing IP repositories
INFO: [IP_Flow 19-1704] No user IP repositories specified
INFO: [IP_Flow 19-2313] Loaded Vivado IP repository 'C:/Xilinx/Vivado/2019.1/data/ip'.
INFO: [DRC 23-27] Running DRC with 2 threads
INFO: [Coretcl 2-168] The results of DRC are in file D:/github_repository/zybo-z7-10/I2C_PCF8574/I2C_PCF8574.runs/impl_1/I2CTopModule_drc_opted.rpt.
report_drc completed successfully
Command: place_design
Attempting to get a license for feature 'Implementation' and/or device 'xc7z010'
INFO: [Common 17-349] Got license for feature 'Implementation' and/or device 'xc7z010'
INFO: [DRC 23-27] Running DRC with 2 threads
INFO: [Vivado_Tcl 4-198] DRC finished with 0 Errors
INFO: [Vivado_Tcl 4-199] Please refer to the DRC report (report_drc) for more information.
Running DRC as a precondition to command place_design
INFO: [DRC 23-27] Running DRC with 2 threads
INFO: [Vivado_Tcl 4-198] DRC finished with 0 Errors
INFO: [Vivado_Tcl 4-199] Please refer to the DRC report (report_drc) for more information.

Starting Placer Task
INFO: [Place 30-611] Multithreading enabled for place_design using a maximum of 2 CPUs

Phase 1 Placer Initialization

Phase 1.1 Placer Initialization Netlist Sorting
Netlist sorting complete. Time (s): cpu = 00:00:00 ; elapsed = 00:00:00 . Memory (MB): peak = 1332.379 ; gain = 0.000
Phase 1.1 Placer Initialization Netlist Sorting | Checksum: 8163938f

Time (s): cpu = 00:00:00 ; elapsed = 00:00:00.005 . Memory (MB): peak = 1332.379 ; gain = 0.000
Netlist sorting complete. Time (s): cpu = 00:00:00 ; elapsed = 00:00:00 . Memory (MB): peak = 1332.379 ; gain = 0.000

Phase 1.2 IO Placement/ Clock Placement/ Build Placer Device
INFO: [Timing 38-35] Done setting XDC timing constraints.
Phase 1.2 IO Placement/ Clock Placement/ Build Placer Device | Checksum: 17d7d34c0

Time (s): cpu = 00:00:00 ; elapsed = 00:00:00.325 . Memory (MB): peak = 1332.379 ; gain = 0.000

Phase 1.3 Build Placer Netlist Model
Phase 1.3 Build Placer Netlist Model | Checksum: 242db9570

Time (s): cpu = 00:00:01 ; elapsed = 00:00:00.406 . Memory (MB): peak = 1332.379 ; gain = 0.000

Phase 1.4 Constrain Clocks/Macros
Phase 1.4 Constrain Clocks/Macros | Checksum: 242db9570

Time (s): cpu = 00:00:01 ; elapsed = 00:00:00.408 . Memory (MB): peak = 1332.379 ; gain = 0.000
Phase 1 Placer Initialization | Checksum: 242db9570

Time (s): cpu = 00:00:01 ; elapsed = 00:00:00.409 . Memory (MB): peak = 1332.379 ; gain = 0.000

Phase 2 Global Placement

Phase 2.1 Floorplanning
Phase 2.1 Floorplanning | Checksum: 1ce79cacd

Time (s): cpu = 00:00:01 ; elapsed = 00:00:00.532 . Memory (MB): peak = 1332.379 ; gain = 0.000

Phase 2.2 Global Placement Core

Phase 2.2.1 Physical Synthesis In Placer
INFO: [Physopt 32-65] No nets found for high-fanout optimization.
INFO: [Physopt 32-232] Optimized 0 net. Created 0 new instance.
INFO: [Physopt 32-775] End 1 Pass. Optimized 0 net or cell. Created 0 new cell, deleted 0 existing cell and moved 0 existing cell
INFO: [Physopt 32-670] No setup violation found.  DSP Register Optimization was not performed.
INFO: [Physopt 32-670] No setup violation found.  Shift Register Optimization was not performed.
INFO: [Physopt 32-670] No setup violation found.  BRAM Register Optimization was not performed.
INFO: [Physopt 32-949] No candidate nets found for HD net replication
INFO: [Physopt 32-775] End 1 Pass. Optimized 0 net or cell. Created 0 new cell, deleted 0 existing cell and moved 0 existing cell
Netlist sorting complete. Time (s): cpu = 00:00:00 ; elapsed = 00:00:00 . Memory (MB): peak = 1332.379 ; gain = 0.000

Summary of Physical Synthesis Optimizations
============================================


----------------------------------------------------------------------------------------------------------------------------------------
|  Optimization                  |  Added Cells  |  Removed Cells  |  Optimized Cells/Nets  |  Dont Touch  |  Iterations  |  Elapsed   |
----------------------------------------------------------------------------------------------------------------------------------------
|  Very High Fanout              |            0  |              0  |                     0  |           0  |           1  |  00:00:00  |
|  DSP Register                  |            0  |              0  |                     0  |           0  |           0  |  00:00:00  |
|  Shift Register                |            0  |              0  |                     0  |           0  |           0  |  00:00:00  |
|  BRAM Register                 |            0  |              0  |                     0  |           0  |           0  |  00:00:00  |
|  HD Interface Net Replication  |            0  |              0  |                     0  |           0  |           1  |  00:00:00  |
|  Total                         |            0  |              0  |                     0  |           0  |           2  |  00:00:00  |
----------------------------------------------------------------------------------------------------------------------------------------


Phase 2.2.1 Physical Synthesis In Placer | Checksum: 2494ca374

Time (s): cpu = 00:00:03 ; elapsed = 00:00:02 . Memory (MB): peak = 1332.379 ; gain = 0.000
Phase 2.2 Global Placement Core | Checksum: 1b06c702e

Time (s): cpu = 00:00:03 ; elapsed = 00:00:02 . Memory (MB): peak = 1332.379 ; gain = 0.000
Phase 2 Global Placement | Checksum: 1b06c702e

Time (s): cpu = 00:00:03 ; elapsed = 00:00:02 . Memory (MB): peak = 1332.379 ; gain = 0.000

Phase 3 Detail Placement

Phase 3.1 Commit Multi Column Macros
Phase 3.1 Commit Multi Column Macros | Checksum: 19eec9ccd

Time (s): cpu = 00:00:03 ; elapsed = 00:00:02 . Memory (MB): peak = 1332.379 ; gain = 0.000

Phase 3.2 Commit Most Macros & LUTRAMs
Phase 3.2 Commit Most Macros & LUTRAMs | Checksum: 22a83d715

Time (s): cpu = 00:00:03 ; elapsed = 00:00:02 . Memory (MB): peak = 1332.379 ; gain = 0.000

Phase 3.3 Area Swap Optimization
Phase 3.3 Area Swap Optimization | Checksum: 257d1bdee

Time (s): cpu = 00:00:03 ; elapsed = 00:00:02 . Memory (MB): peak = 1332.379 ; gain = 0.000

Phase 3.4 Pipeline Register Optimization
Phase 3.4 Pipeline Register Optimization | Checksum: 199da4d72

Time (s): cpu = 00:00:03 ; elapsed = 00:00:02 . Memory (MB): peak = 1332.379 ; gain = 0.000

Phase 3.5 Small Shape Detail Placement
Phase 3.5 Small Shape Detail Placement | Checksum: 148a43dee

Time (s): cpu = 00:00:03 ; elapsed = 00:00:02 . Memory (MB): peak = 1332.379 ; gain = 0.000

Phase 3.6 Re-assign LUT pins
Phase 3.6 Re-assign LUT pins | Checksum: 13ce08a75

Time (s): cpu = 00:00:03 ; elapsed = 00:00:02 . Memory (MB): peak = 1332.379 ; gain = 0.000

Phase 3.7 Pipeline Register Optimization
Phase 3.7 Pipeline Register Optimization | Checksum: 1fae8fa01

Time (s): cpu = 00:00:03 ; elapsed = 00:00:02 . Memory (MB): peak = 1332.379 ; gain = 0.000
Phase 3 Detail Placement | Checksum: 1fae8fa01

Time (s): cpu = 00:00:03 ; elapsed = 00:00:02 . Memory (MB): peak = 1332.379 ; gain = 0.000

Phase 4 Post Placement Optimization and Clean-Up

Phase 4.1 Post Commit Optimization
INFO: [Timing 38-35] Done setting XDC timing constraints.

Phase 4.1.1 Post Placement Optimization
Post Placement Optimization Initialization | Checksum: 150cea90e

Phase 4.1.1.1 BUFG Insertion
INFO: [Place 46-56] BUFG insertion identified 0 candidate nets. Inserted BUFG: 0, Replicated BUFG Driver: 0, Skipped due to Placement/Routing Conflicts: 0, Skipped due to Timing Degradation: 0, Skipped due to Illegal Netlist: 0.
Phase 4.1.1.1 BUFG Insertion | Checksum: 150cea90e

Time (s): cpu = 00:00:03 ; elapsed = 00:00:02 . Memory (MB): peak = 1337.066 ; gain = 4.688
INFO: [Place 30-746] Post Placement Timing Summary WNS=4.390. For the most accurate timing information please run report_timing.
Phase 4.1.1 Post Placement Optimization | Checksum: 1165181c5

Time (s): cpu = 00:00:03 ; elapsed = 00:00:02 . Memory (MB): peak = 1337.066 ; gain = 4.688
Phase 4.1 Post Commit Optimization | Checksum: 1165181c5

Time (s): cpu = 00:00:03 ; elapsed = 00:00:02 . Memory (MB): peak = 1337.066 ; gain = 4.688

Phase 4.2 Post Placement Cleanup
Phase 4.2 Post Placement Cleanup | Checksum: 1165181c5

Time (s): cpu = 00:00:03 ; elapsed = 00:00:02 . Memory (MB): peak = 1337.066 ; gain = 4.688

Phase 4.3 Placer Reporting
Phase 4.3 Placer Reporting | Checksum: 1165181c5

Time (s): cpu = 00:00:03 ; elapsed = 00:00:02 . Memory (MB): peak = 1337.066 ; gain = 4.688

Phase 4.4 Final Placement Cleanup
Netlist sorting complete. Time (s): cpu = 00:00:00 ; elapsed = 00:00:00.001 . Memory (MB): peak = 1337.066 ; gain = 0.000
Phase 4.4 Final Placement Cleanup | Checksum: 140c4e340

Time (s): cpu = 00:00:03 ; elapsed = 00:00:02 . Memory (MB): peak = 1337.066 ; gain = 4.688
Phase 4 Post Placement Optimization and Clean-Up | Checksum: 140c4e340

Time (s): cpu = 00:00:03 ; elapsed = 00:00:02 . Memory (MB): peak = 1337.066 ; gain = 4.688
Ending Placer Task | Checksum: dde69b69

Time (s): cpu = 00:00:03 ; elapsed = 00:00:02 . Memory (MB): peak = 1337.066 ; gain = 4.688
INFO: [Common 17-83] Releasing license: Implementation
53 Infos, 0 Warnings, 0 Critical Warnings and 0 Errors encountered.
place_design completed successfully
Netlist sorting complete. Time (s): cpu = 00:00:00 ; elapsed = 00:00:00 . Memory (MB): peak = 1337.066 ; gain = 0.000
INFO: [Timing 38-480] Writing timing data to binary archive.
Writing placer database...
Writing XDEF routing.
Writing XDEF routing logical nets.
Writing XDEF routing special nets.
Write XDEF Complete: Time (s): cpu = 00:00:01 ; elapsed = 00:00:00.068 . Memory (MB): peak = 1337.133 ; gain = 0.066
INFO: [Common 17-1381] The checkpoint 'D:/github_repository/zybo-z7-10/I2C_PCF8574/I2C_PCF8574.runs/impl_1/I2CTopModule_placed.dcp' has been generated.
INFO: [runtcl-4] Executing : report_io -file I2CTopModule_io_placed.rpt
report_io: Time (s): cpu = 00:00:00 ; elapsed = 00:00:00.072 . Memory (MB): peak = 1337.133 ; gain = 0.000
INFO: [runtcl-4] Executing : report_utilization -file I2CTopModule_utilization_placed.rpt -pb I2CTopModule_utilization_placed.pb
INFO: [runtcl-4] Executing : report_control_sets -verbose -file I2CTopModule_control_sets_placed.rpt
report_control_sets: Time (s): cpu = 00:00:00 ; elapsed = 00:00:00.011 . Memory (MB): peak = 1337.133 ; gain = 0.000
Command: route_design
Attempting to get a license for feature 'Implementation' and/or device 'xc7z010'
INFO: [Common 17-349] Got license for feature 'Implementation' and/or device 'xc7z010'
Running DRC as a precondition to command route_design
INFO: [DRC 23-27] Running DRC with 2 threads
INFO: [Vivado_Tcl 4-198] DRC finished with 0 Errors
INFO: [Vivado_Tcl 4-199] Please refer to the DRC report (report_drc) for more information.


Starting Routing Task
INFO: [Route 35-254] Multithreading enabled for route_design using a maximum of 2 CPUs
Checksum: PlaceDB: 54fe46ea ConstDB: 0 ShapeSum: 88e8547f RouteDB: 0

Phase 1 Build RT Design
Phase 1 Build RT Design | Checksum: 14aa20d01

Time (s): cpu = 00:00:13 ; elapsed = 00:00:12 . Memory (MB): peak = 1388.465 ; gain = 37.289
Post Restoration Checksum: NetGraph: 9205ab52 NumContArr: b89c61af Constraints: 0 Timing: 0

Phase 2 Router Initialization

Phase 2.1 Create Timer
Phase 2.1 Create Timer | Checksum: 14aa20d01

Time (s): cpu = 00:00:13 ; elapsed = 00:00:12 . Memory (MB): peak = 1420.734 ; gain = 69.559

Phase 2.2 Fix Topology Constraints
Phase 2.2 Fix Topology Constraints | Checksum: 14aa20d01

Time (s): cpu = 00:00:13 ; elapsed = 00:00:12 . Memory (MB): peak = 1426.762 ; gain = 75.586

Phase 2.3 Pre Route Cleanup
Phase 2.3 Pre Route Cleanup | Checksum: 14aa20d01

Time (s): cpu = 00:00:13 ; elapsed = 00:00:12 . Memory (MB): peak = 1426.762 ; gain = 75.586
 Number of Nodes with overlaps = 0

Phase 2.4 Update Timing
Phase 2.4 Update Timing | Checksum: 14ae8a49f

Time (s): cpu = 00:00:13 ; elapsed = 00:00:12 . Memory (MB): peak = 1430.094 ; gain = 78.918
INFO: [Route 35-416] Intermediate Timing Summary | WNS=4.349  | TNS=0.000  | WHS=-0.093 | THS=-0.902 |

Phase 2 Router Initialization | Checksum: 1ab1a704f

Time (s): cpu = 00:00:13 ; elapsed = 00:00:12 . Memory (MB): peak = 1430.094 ; gain = 78.918

Router Utilization Summary
  Global Vertical Routing Utilization    = 0 %
  Global Horizontal Routing Utilization  = 0 %
  Routable Net Status*
  *Does not include unroutable nets such as driverless and loadless.
  Run report_route_status for detailed report.
  Number of Failed Nets               = 75
    (Failed Nets is the sum of unrouted and partially routed nets)
  Number of Unrouted Nets             = 75
  Number of Partially Routed Nets     = 0
  Number of Node Overlaps             = 0


Phase 3 Initial Routing
Phase 3 Initial Routing | Checksum: 15dfbab61

Time (s): cpu = 00:00:14 ; elapsed = 00:00:12 . Memory (MB): peak = 1430.094 ; gain = 78.918

Phase 4 Rip-up And Reroute

Phase 4.1 Global Iteration 0
 Number of Nodes with overlaps = 8
 Number of Nodes with overlaps = 0
INFO: [Route 35-416] Intermediate Timing Summary | WNS=4.208  | TNS=0.000  | WHS=N/A    | THS=N/A    |

Phase 4.1 Global Iteration 0 | Checksum: 2a0a3989c

Time (s): cpu = 00:00:14 ; elapsed = 00:00:12 . Memory (MB): peak = 1430.094 ; gain = 78.918
Phase 4 Rip-up And Reroute | Checksum: 2a0a3989c

Time (s): cpu = 00:00:14 ; elapsed = 00:00:12 . Memory (MB): peak = 1430.094 ; gain = 78.918

Phase 5 Delay and Skew Optimization

Phase 5.1 Delay CleanUp

Phase 5.1.1 Update Timing
Phase 5.1.1 Update Timing | Checksum: 2a357d32e

Time (s): cpu = 00:00:14 ; elapsed = 00:00:12 . Memory (MB): peak = 1430.094 ; gain = 78.918
INFO: [Route 35-416] Intermediate Timing Summary | WNS=4.356  | TNS=0.000  | WHS=N/A    | THS=N/A    |

Phase 5.1 Delay CleanUp | Checksum: 2a357d32e

Time (s): cpu = 00:00:14 ; elapsed = 00:00:12 . Memory (MB): peak = 1430.094 ; gain = 78.918

Phase 5.2 Clock Skew Optimization
Phase 5.2 Clock Skew Optimization | Checksum: 2a357d32e

Time (s): cpu = 00:00:14 ; elapsed = 00:00:12 . Memory (MB): peak = 1430.094 ; gain = 78.918
Phase 5 Delay and Skew Optimization | Checksum: 2a357d32e

Time (s): cpu = 00:00:14 ; elapsed = 00:00:12 . Memory (MB): peak = 1430.094 ; gain = 78.918

Phase 6 Post Hold Fix

Phase 6.1 Hold Fix Iter

Phase 6.1.1 Update Timing
Phase 6.1.1 Update Timing | Checksum: 2a94e06ce

Time (s): cpu = 00:00:14 ; elapsed = 00:00:12 . Memory (MB): peak = 1430.094 ; gain = 78.918
INFO: [Route 35-416] Intermediate Timing Summary | WNS=4.356  | TNS=0.000  | WHS=0.193  | THS=0.000  |

Phase 6.1 Hold Fix Iter | Checksum: 1ed797754

Time (s): cpu = 00:00:14 ; elapsed = 00:00:12 . Memory (MB): peak = 1430.094 ; gain = 78.918
Phase 6 Post Hold Fix | Checksum: 1ed797754

Time (s): cpu = 00:00:14 ; elapsed = 00:00:12 . Memory (MB): peak = 1430.094 ; gain = 78.918

Phase 7 Route finalize

Router Utilization Summary
  Global Vertical Routing Utilization    = 0.0315315 %
  Global Horizontal Routing Utilization  = 0.0209099 %
  Routable Net Status*
  *Does not include unroutable nets such as driverless and loadless.
  Run report_route_status for detailed report.
  Number of Failed Nets               = 0
    (Failed Nets is the sum of unrouted and partially routed nets)
  Number of Unrouted Nets             = 0
  Number of Partially Routed Nets     = 0
  Number of Node Overlaps             = 0

Phase 7 Route finalize | Checksum: 2c3a3d13c

Time (s): cpu = 00:00:14 ; elapsed = 00:00:12 . Memory (MB): peak = 1430.094 ; gain = 78.918

Phase 8 Verifying routed nets

 Verification completed successfully
Phase 8 Verifying routed nets | Checksum: 2c3a3d13c

Time (s): cpu = 00:00:14 ; elapsed = 00:00:12 . Memory (MB): peak = 1431.996 ; gain = 80.820

Phase 9 Depositing Routes
Phase 9 Depositing Routes | Checksum: 2d36566d1

Time (s): cpu = 00:00:14 ; elapsed = 00:00:12 . Memory (MB): peak = 1431.996 ; gain = 80.820

Phase 10 Post Router Timing
INFO: [Route 35-57] Estimated Timing Summary | WNS=4.356  | TNS=0.000  | WHS=0.193  | THS=0.000  |

INFO: [Route 35-327] The final timing numbers are based on the router estimated timing analysis. For a complete and accurate timing signoff, please run report_timing_summary.
Phase 10 Post Router Timing | Checksum: 2d36566d1

Time (s): cpu = 00:00:14 ; elapsed = 00:00:12 . Memory (MB): peak = 1431.996 ; gain = 80.820
INFO: [Route 35-16] Router Completed Successfully

Time (s): cpu = 00:00:14 ; elapsed = 00:00:12 . Memory (MB): peak = 1431.996 ; gain = 80.820

Routing Is Done.
INFO: [Common 17-83] Releasing license: Implementation
71 Infos, 0 Warnings, 0 Critical Warnings and 0 Errors encountered.
route_design completed successfully
route_design: Time (s): cpu = 00:00:15 ; elapsed = 00:00:13 . Memory (MB): peak = 1431.996 ; gain = 94.863
Netlist sorting complete. Time (s): cpu = 00:00:00 ; elapsed = 00:00:00 . Memory (MB): peak = 1431.996 ; gain = 0.000
INFO: [Timing 38-480] Writing timing data to binary archive.
Writing placer database...
Writing XDEF routing.
Writing XDEF routing logical nets.
Writing XDEF routing special nets.
Write XDEF Complete: Time (s): cpu = 00:00:00 ; elapsed = 00:00:00.076 . Memory (MB): peak = 1441.844 ; gain = 9.848
INFO: [Common 17-1381] The checkpoint 'D:/github_repository/zybo-z7-10/I2C_PCF8574/I2C_PCF8574.runs/impl_1/I2CTopModule_routed.dcp' has been generated.
INFO: [runtcl-4] Executing : report_drc -file I2CTopModule_drc_routed.rpt -pb I2CTopModule_drc_routed.pb -rpx I2CTopModule_drc_routed.rpx
Command: report_drc -file I2CTopModule_drc_routed.rpt -pb I2CTopModule_drc_routed.pb -rpx I2CTopModule_drc_routed.rpx
INFO: [IP_Flow 19-1839] IP Catalog is up to date.
INFO: [DRC 23-27] Running DRC with 2 threads
INFO: [Coretcl 2-168] The results of DRC are in file D:/github_repository/zybo-z7-10/I2C_PCF8574/I2C_PCF8574.runs/impl_1/I2CTopModule_drc_routed.rpt.
report_drc completed successfully
INFO: [runtcl-4] Executing : report_methodology -file I2CTopModule_methodology_drc_routed.rpt -pb I2CTopModule_methodology_drc_routed.pb -rpx I2CTopModule_methodology_drc_routed.rpx
Command: report_methodology -file I2CTopModule_methodology_drc_routed.rpt -pb I2CTopModule_methodology_drc_routed.pb -rpx I2CTopModule_methodology_drc_routed.rpx
INFO: [Timing 38-35] Done setting XDC timing constraints.
INFO: [DRC 23-133] Running Methodology with 2 threads
INFO: [Coretcl 2-1520] The results of Report Methodology are in file D:/github_repository/zybo-z7-10/I2C_PCF8574/I2C_PCF8574.runs/impl_1/I2CTopModule_methodology_drc_routed.rpt.
report_methodology completed successfully
INFO: [runtcl-4] Executing : report_power -file I2CTopModule_power_routed.rpt -pb I2CTopModule_power_summary_routed.pb -rpx I2CTopModule_power_routed.rpx
Command: report_power -file I2CTopModule_power_routed.rpt -pb I2CTopModule_power_summary_routed.pb -rpx I2CTopModule_power_routed.rpx
INFO: [Timing 38-35] Done setting XDC timing constraints.
Running Vector-less Activity Propagation...

Finished Running Vector-less Activity Propagation
83 Infos, 0 Warnings, 0 Critical Warnings and 0 Errors encountered.
report_power completed successfully
INFO: [runtcl-4] Executing : report_route_status -file I2CTopModule_route_status.rpt -pb I2CTopModule_route_status.pb
INFO: [runtcl-4] Executing : report_timing_summary -max_paths 10 -file I2CTopModule_timing_summary_routed.rpt -pb I2CTopModule_timing_summary_routed.pb -rpx I2CTopModule_timing_summary_routed.rpx -warn_on_violation 
INFO: [Timing 38-91] UpdateTimingParams: Speed grade: -1, Delay Type: min_max.
INFO: [Timing 38-191] Multithreading enabled for timing update using a maximum of 2 CPUs
INFO: [runtcl-4] Executing : report_incremental_reuse -file I2CTopModule_incremental_reuse_routed.rpt
INFO: [Vivado_Tcl 4-1062] Incremental flow is disabled. No incremental reuse Info to report.
INFO: [runtcl-4] Executing : report_clock_utilization -file I2CTopModule_clock_utilization_routed.rpt
INFO: [runtcl-4] Executing : report_bus_skew -warn_on_violation -file I2CTopModule_bus_skew_routed.rpt -pb I2CTopModule_bus_skew_routed.pb -rpx I2CTopModule_bus_skew_routed.rpx
INFO: [Timing 38-91] UpdateTimingParams: Speed grade: -1, Delay Type: min_max.
INFO: [Timing 38-191] Multithreading enabled for timing update using a maximum of 2 CPUs
INFO: [Common 17-206] Exiting Vivado at Wed Aug 21 20:37:13 2019...

*** Running vivado
    with args -log I2CTopModule.vdi -applog -m64 -product Vivado -messageDb vivado.pb -mode batch -source I2CTopModule.tcl -notrace


****** Vivado v2019.1.1 (64-bit)
  **** SW Build 2580384 on Sat Jun 29 08:12:21 MDT 2019
  **** IP Build 2579722 on Sat Jun 29 11:35:40 MDT 2019
    ** Copyright 1986-2019 Xilinx, Inc. All Rights Reserved.

source I2CTopModule.tcl -notrace
Command: open_checkpoint I2CTopModule_routed.dcp

Starting open_checkpoint Task

Time (s): cpu = 00:00:00 ; elapsed = 00:00:00.047 . Memory (MB): peak = 292.375 ; gain = 0.000
INFO: [Device 21-403] Loading part xc7z010clg400-1
INFO: [Netlist 29-17] Analyzing 2 Unisim elements for replacement
INFO: [Netlist 29-28] Unisim Transformation completed in 0 CPU seconds
INFO: [Project 1-479] Netlist was created with Vivado 2019.1.1
INFO: [Project 1-570] Preparing netlist for logic optimization
INFO: [Timing 38-478] Restoring timing data from binary archive.
INFO: [Timing 38-479] Binary timing data restore complete.
INFO: [Project 1-856] Restoring constraints from binary archive.
INFO: [Project 1-853] Binary constraint restore complete.
Reading XDEF placement.
Reading placer database...
Reading XDEF routing.
Read XDEF File: Time (s): cpu = 00:00:00 ; elapsed = 00:00:00.127 . Memory (MB): peak = 1192.035 ; gain = 7.867
Restored from archive | CPU: 0.000000 secs | Memory: 0.000000 MB |
Finished XDEF File Restore: Time (s): cpu = 00:00:00 ; elapsed = 00:00:00.127 . Memory (MB): peak = 1192.035 ; gain = 7.867
Netlist sorting complete. Time (s): cpu = 00:00:00 ; elapsed = 00:00:00 . Memory (MB): peak = 1192.035 ; gain = 0.000
INFO: [Project 1-111] Unisim Transformation Summary:
  A total of 1 instances were transformed.
  IOBUF => IOBUF (IBUF, OBUFT): 1 instances

INFO: [Project 1-604] Checkpoint was created with Vivado v2019.1.1 (64-bit) build 2580384
open_checkpoint: Time (s): cpu = 00:00:17 ; elapsed = 00:00:18 . Memory (MB): peak = 1192.035 ; gain = 899.660
Command: write_bitstream -force I2CTopModule.bit
Attempting to get a license for feature 'Implementation' and/or device 'xc7z010'
INFO: [Common 17-349] Got license for feature 'Implementation' and/or device 'xc7z010'
Running DRC as a precondition to command write_bitstream
INFO: [IP_Flow 19-234] Refreshing IP repositories
INFO: [IP_Flow 19-1704] No user IP repositories specified
INFO: [IP_Flow 19-2313] Loaded Vivado IP repository 'C:/Xilinx/Vivado/2019.1/data/ip'.
INFO: [DRC 23-27] Running DRC with 2 threads
WARNING: [DRC ZPS7-1] PS7 block required: The PS7 cell must be used in this Zynq design in order to enable correct default configuration.
INFO: [Vivado 12-3199] DRC finished with 0 Errors, 1 Warnings
INFO: [Vivado 12-3200] Please refer to the DRC report (report_drc) for more information.
INFO: [Designutils 20-2272] Running write_bitstream with 2 threads.
Loading data files...
Loading site data...
Loading route data...
Processing options...
Creating bitmap...
Creating bitstream...
Writing bitstream ./I2CTopModule.bit...
INFO: [Vivado 12-1842] Bitgen Completed Successfully.
INFO: [Project 1-120] WebTalk data collection is mandatory when using a WebPACK part without a full Vivado license. To see the specific WebTalk data collected for your design, open the usage_statistics_webtalk.html or usage_statistics_webtalk.xml file in the implementation directory.
INFO: [Common 17-83] Releasing license: Implementation
22 Infos, 1 Warnings, 0 Critical Warnings and 0 Errors encountered.
write_bitstream completed successfully
write_bitstream: Time (s): cpu = 00:00:13 ; elapsed = 00:00:12 . Memory (MB): peak = 1634.297 ; gain = 442.262
INFO: [Common 17-206] Exiting Vivado at Wed Aug 21 20:38:29 2019...
